{
  "$schema": "https://json-schema.org/draft/2020-12/schema",
  "$id": "https://game-team/schema/gacha.schema.json",
  "title": "Gacha banner config",
  "description": "Banner + cấu trúc rate/pity (ADR-004). Bám ../../docs/gameplay/progression-and-economy.md. QUAN TRỌNG: schema định nghĩa CẤU TRÚC rate/pity, KHÔNG khoá giá trị (rate, pity threshold là tuning server-side).",
  "type": "object",
  "required": ["schema_version", "id", "pool", "rates"],
  "properties": {
    "schema_version": { "$ref": "https://game-team/schema/common.schema.json#/$defs/schema_version" },
    "id": { "$ref": "https://game-team/schema/common.schema.json#/$defs/gacha_id" },
    "pool": {
      "type": "array",
      "description": "Danh sách hero trong banner (gacha.pool -> hero id).",
      "minItems": 1,
      "items": { "$ref": "https://game-team/schema/common.schema.json#/$defs/hero_id" },
      "uniqueItems": true
    },
    "rates": {
      "type": "array",
      "description": "Cấu trúc tỉ trọng theo rarity. weight là integer cấu trúc — GIÁ TRỊ THẬT là tuning, không đặt ở schema.",
      "minItems": 1,
      "items": {
        "type": "object",
        "required": ["rarity", "weight"],
        "properties": {
          "rarity": { "$ref": "https://game-team/schema/common.schema.json#/$defs/rarity" },
          "weight": { "$ref": "https://game-team/schema/common.schema.json#/$defs/combat_int" }
        },
        "additionalProperties": false
      }
    },
    "pity": {
      "type": "object",
      "description": "Cấu trúc pity (tuỳ chọn). threshold là integer cấu trúc — giá trị thật là tuning.",
      "required": ["enabled"],
      "properties": {
        "enabled": { "type": "boolean" },
        "threshold": { "$ref": "https://game-team/schema/common.schema.json#/$defs/combat_int" },
        "target_rarity": {
          "description": "Rarity được đảm bảo khi chạm ngưỡng pity (tuỳ chọn). Thiếu ⇒ app dùng rarity cao nhất trong rates.",
          "$ref": "https://game-team/schema/common.schema.json#/$defs/rarity"
        }
      },
      "additionalProperties": false
    },
    "cost": {
      "description": "Giá một lần quay (tuỳ chọn về CẤU TRÚC; app BẮT BUỘC có để banner quay được). amount là tuning.",
      "$ref": "https://game-team/schema/common.schema.json#/$defs/cost"
    },
    "dupe_fragments": {
      "type": "array",
      "description": "Số mảnh cấp khi trúng hero đã sở hữu, theo rarity (tuỳ chọn về CẤU TRÚC; app BẮT BUỘC phủ mọi rarity trong rates). amount là tuning.",
      "minItems": 1,
      "items": {
        "type": "object",
        "required": ["rarity", "amount"],
        "properties": {
          "rarity": { "$ref": "https://game-team/schema/common.schema.json#/$defs/rarity" },
          "amount": { "$ref": "https://game-team/schema/common.schema.json#/$defs/combat_int" }
        },
        "additionalProperties": false
      }
    }
  },
  "additionalProperties": false
}
